{
  "settlement_id": "ms-ro-abc123def45678901234567890123456",
  "merchant_id": "mch-canteen-01",
  "merchant_name": "一号食堂",
  "order_id": "ro-abc123def45678901234567890123456",
  "covered_credit_amount": 40,
  "settlement_rate": "0.5000",
  "payable_rmb": "20.00",
  "status": "pending",
  "reason": "兑换履约：ro-abc123def45678901234567890123456",
  "metadata": {},
  "created_at": "2026-07-01T12:00:00Z"
}
